{
  "schema_version": "1.0.0",
  "artifact_type": "competition_integration_fixture_campaign_report_v1",
  "campaign_id": "competition-production-pr7-20260717",
  "capability_id": "competition_production_v1",
  "contract": {
    "path": "runtime_contracts/competition_integration_fixture_campaign_v1.json",
    "sha256": "aa33b1271ae8fa8e97149641d23b42eff912629a657e42fc4af4226e0e5f571d"
  },
  "runs": [
    {
      "problem_id": "2016-C",
      "run_id": "pr7-2016c-full-replay-20260717",
      "profile": "prediction",
      "runtime_pack_sha256": "3ed6b2f742906e6d9bea6a827e597a87f2c8ef49955394a33d15dcbd9f67172c",
      "status": "passed",
      "failure_codes": [],
      "subproblem_count": 3,
      "runtime_seconds": 4093.196503,
      "manual_intervention_count": 2,
      "baseline_wins": 0,
      "baseline_win_rate": 0.0,
      "fatal_error_count": 0,
      "fatal_error_rate": 0.0,
      "submission_admission": true,
      "evidence": [
        {
          "path": "run_manifest.json",
          "sha256": "0e9996121886a0082da585c7b8730bc96c60f162474496645930a0f05675777f"
        },
        {
          "path": "runtime_pack.md",
          "sha256": "3ed6b2f742906e6d9bea6a827e597a87f2c8ef49955394a33d15dcbd9f67172c"
        },
        {
          "path": "runtime_pack.manifest.json",
          "sha256": "dbda7f67325a59e8c8d8769ac4f004eabaa15d0fb10b3b408193563ee7e129f5"
        },
        {
          "path": "official_materials/2016_C/material_manifest.json",
          "sha256": "0d41d9dd9d440a398b0ca37839cb32cb39dc0b04fecfa25270b407de4c107327"
        },
        {
          "path": "full_replay_run_record.json",
          "sha256": "772d0a5f89a5534448123b594922ca8338de3326b5c2868a2e25661c807587bc"
        },
        {
          "path": "competition_production_adapter_report.json",
          "sha256": "fe62a46ebe902dc0c727320ce173f07d56dfe83a018256929694cfc5ce801a5a"
        },
        {
          "path": "model_route_v3.json",
          "sha256": "3e2cf83d5c29731ab58abded129f0ec47246e02651371f26360f01a6b2f86c22"
        },
        {
          "path": "route_runs/Q1/R-BASE/sandboxie_run_execution_attestation.json",
          "sha256": "2f556f10a16baacb0a8d90c32b96f476166a729211a53fc046e05418d30b2634"
        },
        {
          "path": "route_runs/Q1/R-PRIMARY/sandboxie_run_execution_attestation.json",
          "sha256": "2bcca054b13eb9a7010069800156dddac9c356ada2b42bccb5a06f316f23d141"
        },
        {
          "path": "route_runs/Q1/R-ALT/sandboxie_run_execution_attestation.json",
          "sha256": "02142c201aa7e35c000bf1c248c1f5272ba20865cd80d9729cad22d4bcb96290"
        },
        {
          "path": "competition_gate3_decision_Q1.json",
          "sha256": "441d05e52181056c090ac202281a3ef1e0f6f49d2c2318deb2f0c7e71a9e53d6"
        },
        {
          "path": "score_v3_ratings_Q1.json",
          "sha256": "461a2117012caefcb951aab65a21c61d9ef58630c09808b7d1db271bddf46c89"
        },
        {
          "path": "score_v3_Q1.json",
          "sha256": "d69933a9e90180f8fbe29896e83d1711e54264e06dc0fecc8535e1788ca03300"
        },
        {
          "path": "route_comparison_result_Q1.json",
          "sha256": "d45aab809c0e1881403921992c767c69d3ae1e9d7b92da774b4aca6bc5cf29c3"
        },
        {
          "path": "route_runs/Q2/R-BASE/sandboxie_run_execution_attestation.json",
          "sha256": "f82497cc946e840d00d0a8a33ccd6aee882dc3ce1ab0fa1b6f89ef938672268d"
        },
        {
          "path": "route_runs/Q2/R-PRIMARY/sandboxie_run_execution_attestation.json",
          "sha256": "fa588add184378e30c7b9067941833855adf045073f07712f121a148e516681e"
        },
        {
          "path": "route_runs/Q2/R-ALT/sandboxie_run_execution_attestation.json",
          "sha256": "5a4a6bb05c4aafe1cd81d3939a8529d79dbcb11d36e2c2fdd43664eb80ce1535"
        },
        {
          "path": "competition_gate3_decision_Q2.json",
          "sha256": "d30918adc3d74e370ce7ca7c3364a9425702bcc45db93dde5512ebd113e54e86"
        },
        {
          "path": "score_v3_ratings_Q2.json",
          "sha256": "dd6d916e8493ecaf0ad27dae6775f9f42921987ca0bfde19e0bd747a969d9349"
        },
        {
          "path": "score_v3_Q2.json",
          "sha256": "3605c188ca536d251fef82d5cb3b381afb7819c54a210d954520e0f7d95810a2"
        },
        {
          "path": "route_comparison_result_Q2.json",
          "sha256": "ece559507916a1c227909a3439f006158c3764759e92f5b0502f397153453c89"
        },
        {
          "path": "route_runs/Q3/R-BASE/sandboxie_run_execution_attestation.json",
          "sha256": "6577b81b82572c0b3a362ceb1148559a0d3967ff40eecae509f940435baec3dc"
        },
        {
          "path": "route_runs/Q3/R-PRIMARY/sandboxie_run_execution_attestation.json",
          "sha256": "79a2ff54b662049d432dd58ac6bd5ff6037e3364461317e2b531f8a2889c0d62"
        },
        {
          "path": "route_runs/Q3/R-ALT/sandboxie_run_execution_attestation.json",
          "sha256": "f33921ceffb5421c74e31b1af0c4160b28d15da6f24edacb09c02cdc2d4938bd"
        },
        {
          "path": "competition_gate3_decision_Q3.json",
          "sha256": "a352ed14f1dd1f2c017af56ef83cbe0b54bbbdc65b7a60358bb70c684738d5e6"
        },
        {
          "path": "score_v3_ratings_Q3.json",
          "sha256": "a41ca31ed05c0bcf7d6e20647e361be880e8a81efcee508cd8dfdd5c44c9a06f"
        },
        {
          "path": "score_v3_Q3.json",
          "sha256": "cd830ae7fac83fcc966d2f0b8d85b2b48e7440bc7b614825bf5e05f7a8dfbec0"
        },
        {
          "path": "route_comparison_result_Q3.json",
          "sha256": "e1946ef144d8ed4d8cc0fece24d1b9a49518bdba70db21704b9a492bcf56b2f9"
        },
        {
          "path": "paper_candidate_manifest.json",
          "sha256": "3dd577c5005253d766adc89315faf597793bd43f76abf9512981691bfea1507e"
        },
        {
          "path": "paper_production_manifest_v2.json",
          "sha256": "223b94dc57b8180c853dc8de12c6a5a711f0ba535529f2d51781b7ae0b459acd"
        }
      ]
    },
    {
      "problem_id": "2023-B",
      "run_id": "pr7-2023b-full-replay-20260717",
      "profile": "engineering_optimization",
      "runtime_pack_sha256": "6c904fe5b2746262ebc7f58978bca52bc6e573c52d199591ae7c121ef90b61e1",
      "status": "passed",
      "failure_codes": [],
      "subproblem_count": 4,
      "runtime_seconds": 4090.196503,
      "manual_intervention_count": 2,
      "baseline_wins": 0,
      "baseline_win_rate": 0.0,
      "fatal_error_count": 0,
      "fatal_error_rate": 0.0,
      "submission_admission": true,
      "evidence": [
        {
          "path": "run_manifest.json",
          "sha256": "42d389442810876a6978344266b290e30257e62c41eb67df4d5cf0419c8dc71c"
        },
        {
          "path": "runtime_pack.md",
          "sha256": "6c904fe5b2746262ebc7f58978bca52bc6e573c52d199591ae7c121ef90b61e1"
        },
        {
          "path": "runtime_pack.manifest.json",
          "sha256": "61d4cda68469e658aec0542dad511077e70424bfd833da87ddc92e4bb7c665a0"
        },
        {
          "path": "official_materials/2023_B/material_manifest.json",
          "sha256": "3f11d26764fbab5f6de0c8bd518fefe681f178442a8bc8ce35e434a7b19643c0"
        },
        {
          "path": "full_replay_run_record.json",
          "sha256": "be14e7293af40cc4df5f043e5ac0f12b13fb50e360075809519312b1aa21e80d"
        },
        {
          "path": "competition_production_adapter_report.json",
          "sha256": "1e3d626db91c0d27efd552afab32df05f1504f179cdeb702793342c74a4ca950"
        },
        {
          "path": "model_route_v3.json",
          "sha256": "84776916620cb575445d2d0c4a43fb9c789a9fd79ca4bd07657df0bdb3ebc9fe"
        },
        {
          "path": "route_runs/Q1/R-BASE/sandboxie_run_execution_attestation.json",
          "sha256": "fe8ce2389f96943a8f7754a07f939950844958132f2201189e993e3ed4233006"
        },
        {
          "path": "route_runs/Q1/R-PRIMARY/sandboxie_run_execution_attestation.json",
          "sha256": "79d5e5adefa91de5d765aa1664f29ff5e4884e7ba54b38c230e6d324d3acaaee"
        },
        {
          "path": "route_runs/Q1/R-ALT/sandboxie_run_execution_attestation.json",
          "sha256": "9d144e75493b49e0d591d82995767df32f5bce0d99aed2d8ab1755af1d454354"
        },
        {
          "path": "competition_gate3_decision_Q1.json",
          "sha256": "f7cfb3bf60956621a232c7c51ce6a74144b1ebacd791defae0b839639a71cfa1"
        },
        {
          "path": "score_v3_ratings_Q1.json",
          "sha256": "51d99f3ae3ea1d396b9f161c8588a7bc1814dbbd0394f17aa7924c79700e9629"
        },
        {
          "path": "score_v3_Q1.json",
          "sha256": "753f5982392f1aa5923c0668e4eb0205e1f8393b3f5a4f47699cc48d2bbab0af"
        },
        {
          "path": "route_comparison_result_Q1.json",
          "sha256": "4f25e7672c85f8668c875ac3e2b02cbf965c8af069ed407b46adc8c91cb8e169"
        },
        {
          "path": "route_runs/Q2/R-BASE/sandboxie_run_execution_attestation.json",
          "sha256": "264cd53c76d3224f4527387a5eaa67f1e7cbce93c844b97cedc1eb5f352c9089"
        },
        {
          "path": "route_runs/Q2/R-PRIMARY/sandboxie_run_execution_attestation.json",
          "sha256": "fddc25f4322efae678dab4149fa9d2cbcef87addb7844f3655f8ef4efcaa075c"
        },
        {
          "path": "route_runs/Q2/R-ALT/sandboxie_run_execution_attestation.json",
          "sha256": "1db326fd2b3d5abe65c745c1bf7412a6086eb28000d0760eb03d32041c75f449"
        },
        {
          "path": "competition_gate3_decision_Q2.json",
          "sha256": "0ba850432dcac39fe8079ed382f83f2186dcb68890850df4dac6ad1636e17b58"
        },
        {
          "path": "score_v3_ratings_Q2.json",
          "sha256": "042a290f505af270cedd345938fe6358b9c984ae84cb87bf2aca162f0ef7730c"
        },
        {
          "path": "score_v3_Q2.json",
          "sha256": "be9020e979cbf4c0aec58a887a8e9485885f27683255157a63f8105f3a40e0de"
        },
        {
          "path": "route_comparison_result_Q2.json",